{
  "component": "tenant-backend",
  "version": "1.0.0",
  "release_channel": "stable",
  "build_time_utc": "2026-03-02T15:30:00Z",
  "artifact": {
    "file_name": "tenant-backend-1.0.0.zip",
    "sha256": "0123456789abcdef0123456789abcdef0123456789abcdef0123456789abcdef",
    "size_bytes": 10485760,
    "source": "git-release"
  },
  "compatibility": {
    "recommended_frontend": "1.0.x",
    "minimum_installer": "1.0.0",
    "notes": [
      "Warn if frontend major version differs."
    ]
  }
}
